{
  "schemaVersion": "1.1.0",
  "ruleSetId": "algoritmeregister-fria",
  "version": "2026.1",
  "validFrom": "2026-01-01",
  "validUntil": "2027-12-31",
  "jurisdiction": "EU",
  "domain": "algoritmeregister-fria",
  "procedureType": "activiteit-toetsing",
  "conflictResolution": "first-match",
  "rules": [
    {"ruleId": "ALG-1", "name": "algoritmeregister_publicatie", "priority": 500, "sourceRefs": [{"type": "beleid", "title": "Algoritmekader bzk-01", "section": "Impactvolle algoritmes en hoog-risico-AI-systemen staan in het Nederlandse Algoritmeregister", "url": "https://algoritmes.overheid.nl/algoritmekader/voldoen-aan-wetten-en-regels/vereisten/bzk-01-algoritmeregister/", "bronVersie": "2026-03-24", "bronDatum": "2026-03-24"}], "conditions": {}, "outcome": {"compliant": "conditional", "category": "transparantie", "artikel": "BZK-beleid bzk-01; AI Act-toepasselijkheid afzonderlijk vaststellen"}},
    {"ruleId": "ALG-2", "name": "algoritme_beschrijving", "priority": 400, "sourceRefs": [{"type": "wet", "title": "EU AI Act Art. 13", "section": "Transparantie en informatie aan gebruikers", "url": "https://eur-lex.europa.eu/eli/reg/2024/1689"}], "conditions": {}, "outcome": {"compliant": "conditional", "category": "transparantie"}},
    {"ruleId": "ALG-3", "name": "doel_algoritme", "priority": 400, "sourceRefs": [{"type": "beleid", "title": "Algoritmekader versie 2.5", "section": "Algoritmeregister: doel en toepassing van het algoritme", "url": "https://algoritmes.overheid.nl/algoritmekader/over-het-algoritmekader/over-het-algoritmekader/", "bronVersie": "2026-03-24", "bronDatum": "2026-03-24"}], "conditions": {}, "outcome": {"compliant": "conditional", "category": "beschrijving"}},
    {"ruleId": "ALG-4", "name": "besluitvormingsproces", "priority": 400, "sourceRefs": [{"type": "beleid", "title": "Algoritmekader versie 2.5", "section": "Transparantie over besluitvorming en menselijke tussenkomst", "url": "https://algoritmes.overheid.nl/algoritmekader/over-het-algoritmekader/over-het-algoritmekader/", "bronVersie": "2026-03-24", "bronDatum": "2026-03-24"}], "conditions": {}, "outcome": {"compliant": "conditional", "category": "beschrijving"}},
    {"ruleId": "ALG-5", "name": "gegevensverwerking", "priority": 400, "sourceRefs": [{"type": "beleid", "title": "Algoritmekader versie 2.5", "section": "Verantwoord gebruik van gegevens en gegevensbescherming", "url": "https://algoritmes.overheid.nl/algoritmekader/over-het-algoritmekader/over-het-algoritmekader/", "bronVersie": "2026-03-24", "bronDatum": "2026-03-24"}], "conditions": {}, "outcome": {"compliant": "conditional", "category": "gegevens"}},
    {"ruleId": "ALG-6", "name": "menselijke_tussenkomst", "priority": 500, "sourceRefs": [{"type": "wet", "title": "EU AI Act Art. 14", "section": "Human oversight bij hoog-risico AI", "url": "https://eur-lex.europa.eu/eli/reg/2024/1689"}], "conditions": {}, "outcome": {"compliant": "conditional", "category": "oversight"}},
    {"ruleId": "ALG-7", "name": "fundamental_rights_impact", "priority": 500, "sourceRefs": [{"type": "wet", "title": "EU AI Act Art. 27", "section": "Fundamental Rights Impact Assessment (FRIA)", "url": "https://eur-lex.europa.eu/eli/reg/2024/1689", "bronVersie": "2024-06-13", "bronDatum": "2024-06-13"}, {"type": "standaard", "title": "Impact Assessment Mensenrechten en Algoritmes", "section": "Interdisciplinaire dialoog en besluitvorming over grondrechtenimpact", "url": "https://algoritmes.overheid.nl/algoritmekader/voldoen-aan-wetten-en-regels/hulpmiddelen/IAMA/index.html", "bronVersie": "2026-02-17", "bronDatum": "2026-02-17"}], "conditions": {}, "outcome": {"compliant": "conditional", "category": "fria", "linked_dpia": true}},
    {"ruleId": "ALG-8", "name": "fria_uitvoering", "priority": 500, "sourceRefs": [{"type": "wet", "title": "EU AI Act Art. 27(1)", "section": "FRIA uitvoeren voor hoog-risico AI", "url": "https://eur-lex.europa.eu/eli/reg/2024/1689", "bronVersie": "2024-06-13", "bronDatum": "2024-06-13"}, {"type": "standaard", "title": "Impact Assessment Mensenrechten en Algoritmes", "section": "IAMA 2026 als hulpmiddel; geen checklist of zelfstandig compliance-oordeel", "url": "https://algoritmes.overheid.nl/algoritmekader/voldoen-aan-wetten-en-regels/hulpmiddelen/IAMA/index.html", "bronVersie": "2026-02-17", "bronDatum": "2026-02-17"}], "conditions": {}, "outcome": {"compliant": false, "category": "fria", "actionRequired": "FRIA uitvoeren vóór inzet"}},
    {"ruleId": "ALG-9", "name": "fria_rechten_vrijheden", "priority": 400, "sourceRefs": [{"type": "wet", "title": "EU AI Act Art. 27(2)", "section": "Beoordeling impact op grondrechten", "url": "https://eur-lex.europa.eu/eli/reg/2024/1689"}], "conditions": {}, "outcome": {"compliant": "conditional", "category": "fria"}},
    {"ruleId": "ALG-10", "name": "fria_kwetsbare_groepen", "priority": 400, "sourceRefs": [{"type": "wet", "title": "EU AI Act Art. 27(3)", "section": "Specifieke aandacht voor kwetsbare groepen", "url": "https://eur-lex.europa.eu/eli/reg/2024/1689"}], "conditions": {}, "outcome": {"compliant": "conditional", "category": "fria"}},
    {"ruleId": "ALG-11", "name": "bias_monitoring", "priority": 400, "sourceRefs": [{"type": "wet", "title": "EU AI Act Art. 10", "section": "Data governance en bias monitoring", "url": "https://eur-lex.europa.eu/eli/reg/2024/1689"}], "conditions": {}, "outcome": {"compliant": "conditional", "category": "bias"}},
    {"ruleId": "ALG-12", "name": "technische_documentatie", "priority": 400, "sourceRefs": [{"type": "wet", "title": "EU AI Act Art. 11", "section": "Technische documentatie bijhouden", "url": "https://eur-lex.europa.eu/eli/reg/2024/1689"}], "conditions": {}, "outcome": {"compliant": "conditional", "category": "documentatie"}},
    {"ruleId": "ALG-13", "name": "conformiteitsbeoordeling", "priority": 500, "sourceRefs": [{"type": "wet", "title": "EU AI Act Art. 43", "section": "Conformiteitsbeoordeling hoog-risico AI", "url": "https://eur-lex.europa.eu/eli/reg/2024/1689"}], "conditions": {}, "outcome": {"compliant": "conditional", "category": "conformiteit"}},
    {"ruleId": "ALG-14", "name": "CE_markering_ai", "priority": 400, "sourceRefs": [{"type": "wet", "title": "EU AI Act Art. 49", "section": "CE-markering voor hoog-risico AI", "url": "https://eur-lex.europa.eu/eli/reg/2024/1689"}], "conditions": {}, "outcome": {"compliant": "conditional", "category": "markering"}},
    {"ruleId": "ALG-15", "name": "registratie_eu_database", "priority": 400, "sourceRefs": [{"type": "wet", "title": "EU AI Act Art. 71", "section": "Registratie in EU-database", "url": "https://eur-lex.europa.eu/eli/reg/2024/1689"}], "conditions": {}, "outcome": {"compliant": "conditional", "category": "registratie"}},
    {"ruleId": "ALG-16", "name": "meldpplicht_incidenten", "priority": 500, "sourceRefs": [{"type": "wet", "title": "EU AI Act Art. 72", "section": "Melding van ernstige incidenten", "url": "https://eur-lex.europa.eu/eli/reg/2024/1689"}], "conditions": {}, "outcome": {"compliant": "conditional", "category": "incident"}},
    {"ruleId": "ALG-17", "name": "uitlegbaarheid", "priority": 400, "sourceRefs": [{"type": "wet", "title": "EU AI Act Art. 13(1)", "section": "AI-systeem moet uitlegbaar zijn", "url": "https://eur-lex.europa.eu/eli/reg/2024/1689"}], "conditions": {}, "outcome": {"compliant": "conditional", "category": "uitlegbaarheid"}},
    {"ruleId": "ALG-18", "name": "nauwkeurigheid_robuustheid", "priority": 400, "sourceRefs": [{"type": "wet", "title": "EU AI Act Art. 15", "section": "Nauwkeurigheid, robuustheid, cybersecurity", "url": "https://eur-lex.europa.eu/eli/reg/2024/1689"}], "conditions": {}, "outcome": {"compliant": "conditional", "category": "prestaties"}},
    {"ruleId": "ALG-19", "name": "logging_ai_systeem", "priority": 400, "sourceRefs": [{"type": "wet", "title": "EU AI Act Art. 12", "section": "Logging bij hoog-risico AI-systemen", "url": "https://eur-lex.europa.eu/eli/reg/2024/1689"}], "conditions": {}, "outcome": {"compliant": "conditional", "category": "logging"}},
    {"ruleId": "ALG-20", "name": "gebruiksaanwijzing", "priority": 300, "sourceRefs": [{"type": "wet", "title": "EU AI Act Art. 13(2)", "section": "Gebruiksaanwijzing voor deployers", "url": "https://eur-lex.europa.eu/eli/reg/2024/1689"}], "conditions": {}, "outcome": {"compliant": "conditional", "category": "documentatie"}}
  ]
}
