{
  "schemaVersion": "1.1.0",
  "ruleSetId": "nist-csf",
  "version": "2026.1",
  "validFrom": "2026-01-01",
  "validUntil": "2027-12-31",
  "jurisdiction": "US",
  "domain": "nist-csf",
  "procedureType": "activiteit-toetsing",
  "conflictResolution": "first-match",
  "rules": [
    {"ruleId": "CSF-GV", "name": "govern", "priority": 400, "sourceRefs": [{"type": "standaard", "title": "NIST CSF 2.0 GV", "section": "Govern (new in 2.0)", "url": "https://www.nist.gov/cyberframework", "bronVersie": "NIST Cybersecurity Framework 2.0"}], "conditions": {}, "outcome": {"compliant": "conditional", "category": "govern", "artikel": "NIST CSF 2.0 GV"}},
    {"ruleId": "CSF-GV.1", "name": "cybersecurity_risk_management_strategy", "priority": 400, "sourceRefs": [{"type": "standaard", "title": "NIST CSF 2.0 GV.1", "section": "Cybersecurity risk management strategy", "url": "https://www.nist.gov/cyberframework", "bronVersie": "NIST Cybersecurity Framework 2.0"}], "conditions": {}, "outcome": {"compliant": "conditional", "category": "govern"}},
    {"ruleId": "CSF-GV.2", "name": "cybersecurity_risk_management_roles", "priority": 300, "sourceRefs": [{"type": "standaard", "title": "NIST CSF 2.0 GV.2", "section": "Roles and responsibilities", "url": "https://www.nist.gov/cyberframework", "bronVersie": "NIST Cybersecurity Framework 2.0"}], "conditions": {}, "outcome": {"compliant": "conditional", "category": "govern"}},
    {"ruleId": "CSF-GV.3", "name": "legal_regulatory_requirements", "priority": 400, "sourceRefs": [{"type": "standaard", "title": "NIST CSF 2.0 GV.3", "section": "Legal and regulatory requirements", "url": "https://www.nist.gov/cyberframework", "bronVersie": "NIST Cybersecurity Framework 2.0"}], "conditions": {}, "outcome": {"compliant": "conditional", "category": "govern"}},
    {"ruleId": "CSF-ID", "name": "identify", "priority": 400, "sourceRefs": [{"type": "standaard", "title": "NIST CSF 2.0 ID", "section": "Identify function", "url": "https://www.nist.gov/cyberframework", "bronVersie": "NIST Cybersecurity Framework 2.0"}], "conditions": {}, "outcome": {"compliant": "conditional", "category": "identify"}},
    {"ruleId": "CSF-ID.1", "name": "asset_management", "priority": 300, "sourceRefs": [{"type": "standaard", "title": "NIST CSF 2.0 ID.1", "section": "Asset identification and management", "url": "https://www.nist.gov/cyberframework", "bronVersie": "NIST Cybersecurity Framework 2.0"}], "conditions": {}, "outcome": {"compliant": "conditional", "category": "identify"}},
    {"ruleId": "CSF-ID.2", "name": "risk_assessment", "priority": 500, "sourceRefs": [{"type": "standaard", "title": "NIST CSF 2.0 ID.2", "section": "Cybersecurity risk assessment", "url": "https://www.nist.gov/cyberframework", "bronVersie": "NIST Cybersecurity Framework 2.0"}], "conditions": {}, "outcome": {"compliant": "conditional", "category": "identify", "linked_iso31000": "RM-5.5"}},
    {"ruleId": "CSF-ID.3", "name": "supply_chain_risk", "priority": 400, "sourceRefs": [{"type": "standaard", "title": "NIST CSF 2.0 ID.3", "section": "Supply chain risk management", "url": "https://www.nist.gov/cyberframework", "bronVersie": "NIST Cybersecurity Framework 2.0"}], "conditions": {}, "outcome": {"compliant": "conditional", "category": "identify"}},
    {"ruleId": "CSF-PR", "name": "protect", "priority": 500, "sourceRefs": [{"type": "standaard", "title": "NIST CSF 2.0 PR", "section": "Protect function", "url": "https://www.nist.gov/cyberframework", "bronVersie": "NIST Cybersecurity Framework 2.0"}], "conditions": {}, "outcome": {"compliant": "conditional", "category": "protect"}},
    {"ruleId": "CSF-PR.1", "name": "identity_management_access_control", "priority": 500, "sourceRefs": [{"type": "standaard", "title": "NIST CSF 2.0 PR.1", "section": "Identity management and access control", "url": "https://www.nist.gov/cyberframework", "bronVersie": "NIST Cybersecurity Framework 2.0"}], "conditions": {}, "outcome": {"compliant": "conditional", "category": "protect", "linked_iso27002": "A.8.2"}},
    {"ruleId": "CSF-PR.2", "name": "awareness_training", "priority": 300, "sourceRefs": [{"type": "standaard", "title": "NIST CSF 2.0 PR.2", "section": "Awareness and training", "url": "https://www.nist.gov/cyberframework", "bronVersie": "NIST Cybersecurity Framework 2.0"}], "conditions": {}, "outcome": {"compliant": "conditional", "category": "protect"}},
    {"ruleId": "CSF-PR.3", "name": "data_security", "priority": 500, "sourceRefs": [{"type": "standaard", "title": "NIST CSF 2.0 PR.3", "section": "Data security", "url": "https://www.nist.gov/cyberframework", "bronVersie": "NIST Cybersecurity Framework 2.0"}], "conditions": {}, "outcome": {"compliant": "conditional", "category": "protect", "linked_iso27002": "A.8.11"}},
    {"ruleId": "CSF-PR.4", "name": "platform_security", "priority": 400, "sourceRefs": [{"type": "standaard", "title": "NIST CSF 2.0 PR.4", "section": "Platform security", "url": "https://www.nist.gov/cyberframework", "bronVersie": "NIST Cybersecurity Framework 2.0"}], "conditions": {}, "outcome": {"compliant": "conditional", "category": "protect"}},
    {"ruleId": "CSF-PR.5", "name": "infrastructure_resilience", "priority": 400, "sourceRefs": [{"type": "standaard", "title": "NIST CSF 2.0 PR.5", "section": "Infrastructure resilience", "url": "https://www.nist.gov/cyberframework", "bronVersie": "NIST Cybersecurity Framework 2.0"}], "conditions": {}, "outcome": {"compliant": "conditional", "category": "protect"}},
    {"ruleId": "CSF-DE", "name": "detect", "priority": 400, "sourceRefs": [{"type": "standaard", "title": "NIST CSF 2.0 DE", "section": "Detect function", "url": "https://www.nist.gov/cyberframework", "bronVersie": "NIST Cybersecurity Framework 2.0"}], "conditions": {}, "outcome": {"compliant": "conditional", "category": "detect"}},
    {"ruleId": "CSF-DE.1", "name": "continuous_monitoring", "priority": 400, "sourceRefs": [{"type": "standaard", "title": "NIST CSF 2.0 DE.1", "section": "Continuous monitoring", "url": "https://www.nist.gov/cyberframework", "bronVersie": "NIST Cybersecurity Framework 2.0"}], "conditions": {}, "outcome": {"compliant": "conditional", "category": "detect", "linked_iso27002": "A.8.16"}},
    {"ruleId": "CSF-DE.2", "name": "adverse_event_analysis", "priority": 400, "sourceRefs": [{"type": "standaard", "title": "NIST CSF 2.0 DE.2", "section": "Adverse event analysis", "url": "https://www.nist.gov/cyberframework", "bronVersie": "NIST Cybersecurity Framework 2.0"}], "conditions": {}, "outcome": {"compliant": "conditional", "category": "detect"}},
    {"ruleId": "CSF-RS", "name": "respond", "priority": 400, "sourceRefs": [{"type": "standaard", "title": "NIST CSF 2.0 RS", "section": "Respond function", "url": "https://www.nist.gov/cyberframework", "bronVersie": "NIST Cybersecurity Framework 2.0"}], "conditions": {}, "outcome": {"compliant": "conditional", "category": "respond"}},
    {"ruleId": "CSF-RS.1", "name": "incident_management", "priority": 500, "sourceRefs": [{"type": "standaard", "title": "NIST CSF 2.0 RS.1", "section": "Incident management", "url": "https://www.nist.gov/cyberframework", "bronVersie": "NIST Cybersecurity Framework 2.0"}], "conditions": {}, "outcome": {"compliant": "conditional", "category": "respond", "linked_iso22301": "8.4"}},
    {"ruleId": "CSF-RS.2", "name": "incident_analysis", "priority": 400, "sourceRefs": [{"type": "standaard", "title": "NIST CSF 2.0 RS.2", "section": "Incident analysis", "url": "https://www.nist.gov/cyberframework", "bronVersie": "NIST Cybersecurity Framework 2.0"}], "conditions": {}, "outcome": {"compliant": "conditional", "category": "respond"}},
    {"ruleId": "CSF-RS.3", "name": "incident_reporting", "priority": 400, "sourceRefs": [{"type": "standaard", "title": "NIST CSF 2.0 RS.3", "section": "Incident reporting", "url": "https://www.nist.gov/cyberframework", "bronVersie": "NIST Cybersecurity Framework 2.0"}], "conditions": {}, "outcome": {"compliant": "conditional", "category": "respond", "linked_nis2": "Art. 23"}},
    {"ruleId": "CSF-RC", "name": "recover", "priority": 400, "sourceRefs": [{"type": "standaard", "title": "NIST CSF 2.0 RC", "section": "Recover function", "url": "https://www.nist.gov/cyberframework", "bronVersie": "NIST Cybersecurity Framework 2.0"}], "conditions": {}, "outcome": {"compliant": "conditional", "category": "recover"}},
    {"ruleId": "CSF-RC.1", "name": "incident_recovery_execution", "priority": 400, "sourceRefs": [{"type": "standaard", "title": "NIST CSF 2.0 RC.1", "section": "Incident recovery plan execution", "url": "https://www.nist.gov/cyberframework", "bronVersie": "NIST Cybersecurity Framework 2.0"}], "conditions": {}, "outcome": {"compliant": "conditional", "category": "recover", "linked_iso22301": "8.4"}},
    {"ruleId": "CSF-RC.2", "name": "incident_recovery_communication", "priority": 300, "sourceRefs": [{"type": "standaard", "title": "NIST CSF 2.0 RC.2", "section": "Incident recovery communication", "url": "https://www.nist.gov/cyberframework", "bronVersie": "NIST Cybersecurity Framework 2.0"}], "conditions": {}, "outcome": {"compliant": "conditional", "category": "recover"}}
  ]
}
